{
  "delivery_report_id": "dr_9c026a104e3745c3",
  "work_order_id": "wo_9c026a104e3745c3",
  "milestone": "DC-003-I029",
  "status": "completed",
  "commit": "7d88509",
  "push_status": "pushed",
  "working_tree": "clean",
  "tests": { "passed": 1300, "failed": 0, "total": 1300 },
  "fixtures": { "passed": 17, "failed": 0, "total": 17 },
  "files_created": ["schemas/engineering-work-order.schema.json", "schemas/engineering-delivery-report.schema.json"],
  "files_modified": ["README.md"],
  "repository_findings": [
    "No structured milestone brief or delivery report objects existed anywhere in the repository prior to this milestone — every prior brief/report was chat-only"
  ],
  "compatibility": ["I008-I012 unchanged", "I014 unchanged", "I015 unchanged", "I021-I028 unchanged"],
  "live_requests": { "occurred": false, "details": null },
  "follow_up_required": [],
  "delivery_timestamp": "2026-08-05T12:00:00Z",
  "notes": null
}
